{
  "api_version": "v1",
  "input_bundle": {
    "uri": "file:///tmp/sec-review-fixtures/issue-review-test-changes.tar.zst",
    "digest": "sha256:0000000000000000000000000000000000000000000000000000000000000000",
    "media_type": "application/tar+zstd",
    "size_bytes": 0
  },
  "review_intent": {
    "objective": "repair",
    "test_changes": "deny"
  },
  "issue": {
    "owner": "octo-org",
    "repo": "example",
    "repo_full_name": "octo-org/example",
    "number": 102,
    "title": "Unsafe redirect in callback handler",
    "body": "Please review the callback redirect validation."
  }
}
