{
  "api_version": "v1",
  "input_bundle": {
    "uri": "file:///tmp/sec-review-fixtures/issue-review-setup-declaration.tar.zst",
    "digest": "sha256:0000000000000000000000000000000000000000000000000000000000000000",
    "media_type": "application/tar+zstd",
    "size_bytes": 0
  },
  "review_intent": {
    "objective": "repair"
  },
  "issue": {
    "owner": "octo-org",
    "repo": "example",
    "repo_full_name": "octo-org/example",
    "number": 103,
    "title": "Unsafe redirect in callback handler",
    "body": "Please review the callback redirect validation."
  },
  "setup_declaration": "setup:\n  - run: npm ci\n    timeout_seconds: 300\n"
}
